{
  "schema_version": "0.1",
  "name": "Server room complexity level 1",
  "units": "meters",
  "objects": [
    {"id":"floor","primitive":"box","dimensions":[8,6,0.12],"position":[0,0,-0.06],"color":[0.12,0.14,0.17,1]},
    {"id":"back_wall","primitive":"box","dimensions":[8,0.12,3],"position":[0,3,1.5],"color":[0.55,0.58,0.62,1]},
    {"id":"left_wall","primitive":"box","dimensions":[0.12,6,3],"position":[-4,0,1.5],"color":[0.48,0.51,0.55,1]},
    {"id":"right_wall","primitive":"box","dimensions":[0.12,6,3],"position":[4,0,1.5],"color":[0.48,0.51,0.55,1]},

    {"id":"rack_a1","primitive":"box","dimensions":[0.75,0.95,2.1],"position":[-2.4,1.15,1.05],"color":[0.035,0.045,0.06,1]},
    {"id":"rack_a2","primitive":"box","dimensions":[0.75,0.95,2.1],"position":[-0.8,1.15,1.05],"color":[0.035,0.045,0.06,1]},
    {"id":"rack_a3","primitive":"box","dimensions":[0.75,0.95,2.1],"position":[0.8,1.15,1.05],"color":[0.035,0.045,0.06,1]},
    {"id":"rack_a4","primitive":"box","dimensions":[0.75,0.95,2.1],"position":[2.4,1.15,1.05],"color":[0.035,0.045,0.06,1]},
    {"id":"rack_b1","primitive":"box","dimensions":[0.75,0.95,2.1],"position":[-2.4,-1.15,1.05],"color":[0.035,0.045,0.06,1]},
    {"id":"rack_b2","primitive":"box","dimensions":[0.75,0.95,2.1],"position":[-0.8,-1.15,1.05],"color":[0.035,0.045,0.06,1]},
    {"id":"rack_b3","primitive":"box","dimensions":[0.75,0.95,2.1],"position":[0.8,-1.15,1.05],"color":[0.035,0.045,0.06,1]},
    {"id":"rack_b4","primitive":"box","dimensions":[0.75,0.95,2.1],"position":[2.4,-1.15,1.05],"color":[0.035,0.045,0.06,1]},

    {"id":"server_a1","primitive":"box","dimensions":[0.62,0.06,0.28],"position":[-2.4,0.645,1.35],"color":[0.08,0.32,0.68,1]},
    {"id":"server_a2","primitive":"box","dimensions":[0.62,0.06,0.28],"position":[-0.8,0.645,1.35],"color":[0.08,0.32,0.68,1]},
    {"id":"server_a3","primitive":"box","dimensions":[0.62,0.06,0.28],"position":[0.8,0.645,1.35],"color":[0.08,0.32,0.68,1]},
    {"id":"server_a4","primitive":"box","dimensions":[0.62,0.06,0.28],"position":[2.4,0.645,1.35],"color":[0.08,0.32,0.68,1]},
    {"id":"server_b1","primitive":"box","dimensions":[0.62,0.06,0.28],"position":[-2.4,-0.645,1.35],"color":[0.15,0.52,0.3,1]},
    {"id":"server_b2","primitive":"box","dimensions":[0.62,0.06,0.28],"position":[-0.8,-0.645,1.35],"color":[0.15,0.52,0.3,1]},
    {"id":"server_b3","primitive":"box","dimensions":[0.62,0.06,0.28],"position":[0.8,-0.645,1.35],"color":[0.72,0.12,0.08,1]},
    {"id":"server_b4","primitive":"box","dimensions":[0.62,0.06,0.28],"position":[2.4,-0.645,1.35],"color":[0.15,0.52,0.3,1]},

    {"id":"cooling_left","primitive":"box","dimensions":[0.9,0.7,2.2],"position":[-3.25,2.45,1.1],"color":[0.78,0.82,0.86,1]},
    {"id":"cooling_right","primitive":"box","dimensions":[0.9,0.7,2.2],"position":[3.25,2.45,1.1],"color":[0.78,0.82,0.86,1]},
    {"id":"cold_aisle","primitive":"box","dimensions":[6.2,0.9,0.025],"position":[0,0,0.015],"color":[0.04,0.28,0.55,1]},

    {"id":"status_a1","primitive":"sphere","radius":0.055,"position":[-2.4,0.605,1.7],"color":[0.1,1,0.2,1]},
    {"id":"status_a2","primitive":"sphere","radius":0.055,"position":[-0.8,0.605,1.7],"color":[0.1,1,0.2,1]},
    {"id":"status_a3","primitive":"sphere","radius":0.055,"position":[0.8,0.605,1.7],"color":[1,0.7,0.05,1]},
    {"id":"status_a4","primitive":"sphere","radius":0.055,"position":[2.4,0.605,1.7],"color":[0.1,1,0.2,1]},
    {"id":"status_b1","primitive":"sphere","radius":0.055,"position":[-2.4,-0.605,1.7],"color":[0.1,1,0.2,1]},
    {"id":"status_b2","primitive":"sphere","radius":0.055,"position":[-0.8,-0.605,1.7],"color":[0.1,1,0.2,1]},
    {"id":"status_b3","primitive":"sphere","radius":0.055,"position":[0.8,-0.605,1.7],"color":[1,0.08,0.03,1]},
    {"id":"status_b4","primitive":"sphere","radius":0.055,"position":[2.4,-0.605,1.7],"color":[0.1,1,0.2,1]},

    {"id":"sensor_1","primitive":"cylinder","radius":0.1,"depth":0.24,"position":[-1.6,2.72,2.35],"rotation_deg":[90,0,0],"color":[1,0.65,0.05,1]},
    {"id":"sensor_2","primitive":"cylinder","radius":0.1,"depth":0.24,"position":[1.6,2.72,2.35],"rotation_deg":[90,0,0],"color":[1,0.65,0.05,1]}
  ]
}
